{
  "eyebrow": "Colophon",
  "heading": "Certifications & Trainings",
  "note": "Realistic fictional credentials for the SiteKit demo",
  "panelLabel": "Sample Credentials",
  "panelNote": "3 certifications · 4 courses",
  "miniBadgesLabel": "Also completed",
  "badges": [
    { "image": "badges/accessible-web.webp", "title": "Accessible Web Professional", "issuer": "Inclusive Interface Guild" },
    { "image": "badges/cloud-systems.webp", "title": "Cloud Systems Practitioner", "issuer": "Northstar Technology Institute" },
    { "image": "badges/web-performance.webp", "title": "Web Performance Specialist", "issuer": "Open Web Academy" }
  ],
  "miniBadges": [
    { "icon": "ti-code", "label": "Practical TypeScript Patterns", "issuer": "Northstar Technology Institute" },
    { "icon": "ti-activity-heartbeat", "label": "Observability for Web Services", "issuer": "Systems Craft School" },
    { "icon": "ti-api", "label": "Designing Resilient APIs", "issuer": "Systems Craft School" },
    { "icon": "ti-shield-check", "label": "Secure Delivery Pipelines", "issuer": "Open Web Academy" }
  ]
}
